{
  "$schema": "http://json-schema.org/draft-07/schema#",
  "$id": "https://github.com/by-dev-tools/flow/plugins/flow/skills/verify-build/lib/findings-schema.json",
  "title": "verify-build findings buffer",
  "description": "Schema for the structured findings buffer written by /flow:verify-build Step 8. Consumed by /flow:ship Step 4a (FB-XXXX synthesis) and by the future HTML case-study renderer (PR R candidate). Shape is a superset of what each consumer needs so neither needs a schema migration.",
  "type": "object",
  "required": [
    "schema_version",
    "metadata",
    "overall_verdict",
    "exit_code",
    "criteria",
    "not_tested"
  ],
  "properties": {
    "schema_version": {
      "type": "string",
      "const": "1.0",
      "description": "Schema version. Bump on breaking changes; never on additive changes."
    },
    "metadata": {
      "type": "object",
      "required": ["branch", "head_sha_short", "plugin_version", "platform_hint"],
      "properties": {
        "branch": {
          "type": "string",
          "description": "Git branch the verify pass ran against (`git branch --show-current`)."
        },
        "head_sha_short": {
          "type": "string",
          "description": "Short SHA of HEAD at verify time (`git rev-parse --short HEAD`)."
        },
        "plugin_version": {
          "type": "string",
          "description": "Version of the flow plugin that produced this buffer (read from plugin.json)."
        },
        "platform_hint": {
          "type": "string",
          "enum": ["web", "ios", "android", "tauri", "cli", "library", "none", "unknown"],
          "description": "Project platform as resolved by bundled /run; informs which not-tested checklist to use. 'unknown' when /run autodetect was ambiguous."
        },
        "verify_budget_calls_used": {
          "type": "integer",
          "minimum": 0,
          "description": "Tool-call count consumed by bundled /verify during Step 5. Compared against flow.config.json.verifyBudgetCalls."
        },
        "verify_budget_overrun": {
          "type": "boolean",
          "description": "True if budget cap fired and all unjudged verdicts were forced to Unknown."
        },
        "spike_mode": {
          "type": "boolean",
          "description": "True ONLY for an explicit spike declaration (invoked via /flow:ship-spike — trigger 1). NO LONGER set for a missing/Spec-walk-less plan; that is `no_plan_fallback`. Spike's reduced rigor (3-check rubric) requires the explicit declaration, never merely an absent plan."
        },
        "no_plan_fallback": {
          "type": "boolean",
          "description": "True when verify-build ran WITHOUT a governing plan because none was found (missing planPath — trigger 2 — or no **Spec-walk:** block — trigger 3), DISTINCT from an explicit spike. On a source-touching diff this path still spawns the fresh-context adversarial judges over diff-derived criteria (provenance stays `adversarial-judged`); /flow:ship routes a source-touching no_plan_fallback to the draft manifest (declare criteria + re-verify, or human-waive). Absent/false ⇒ a plan governed this run."
        },
        "visual_significant": {
          "type": "boolean",
          "description": "The ONE authoritative visual-significance verdict (Feature 1a), computed by lib/visual-significance.py and stamped here so downstream steps (ship Step 5c distill + Step 7 dual-deliverable gate) read ONE value instead of re-deriving it (FB-0010 fan-out defense). True ⇒ this change touches a UI/asset surface (or a Visual-walk block / agent flag forced it) on a uiSurface!=false project, and is not a pure no-render-delta refactor. When true, the capture→buffer→render path (verify-build Steps 5a/8/10) is MANDATORY: a visually-significant change with ZERO captured frames is Unknown, never PASS. Absent/false ⇒ no visual deliverables are required by the ship gate. Additive in schema_version 1.0."
        },
        "visual_signals": {
          "type": "array",
          "items": {"type": "string"},
          "description": "Human-readable evidence lines behind `visual_significant` (the WHY: which UI/asset files matched, whether an override fired, whether a refactor was excluded). Surfaced in the ship log + the skip-audit. Additive in schema_version 1.0."
        },
        "vacuous_criteria_found": {
          "type": "array",
          "items": {"type": "string"},
          "description": "Verbatim text of each declared Spec-walk criterion Step 3's deterministic `lib/criterion-specificity.py` flagged as having no observable predicate (e.g. 'Rate limiting works correctly' — no named output/state/value/error path). Empty or absent when none were flagged. Consumed by /flow:ship Step 2: a non-empty list routes one `[vacuous-criterion]` draft-manifest entry per criterion (the over-broad-declaration seam /flow:audit-coverage's presence-only check leaves open — this is verify-build's criterion-QUALITY axis, not coverage's criterion-PRESENCE one). A deterministic heuristic, never an LLM judgment. Additive in schema_version 1.0; older consumers ignore it."
        }
      },
      "additionalProperties": false
    },
    "overall_verdict": {
      "type": "string",
      "enum": ["PASS", "FAIL", "Unknown"],
      "description": "Aggregated verdict per Step 7. Any FAIL or any Unknown across dimensions/criteria aggregates here."
    },
    "exit_code": {
      "type": "integer",
      "enum": [0, 1],
      "description": "0 for PASS; 1 for FAIL or Unknown. Pins the gate-blocking contract."
    },
    "criteria": {
      "type": "array",
      "description": "One entry per criterion extracted from the plan (or per spike-rubric check in spike mode).",
      "items": {
        "type": "object",
        "required": ["text", "adversarial_cases", "observations", "verdicts", "aggregated_verdict"],
        "properties": {
          "text": {
            "type": "string",
            "description": "Verbatim criterion text from the plan's **Spec-walk:** block (or spike-rubric check name)."
          },
          "provenance": {
            "type": "string",
            "enum": ["adversarial-judged", "spike-rubric", "hand-authored"],
            "description": "HOW this criterion's verdict was produced — the non-forgeability signal the Test-plan + report renderers key on. `adversarial-judged`: the Step-6 fresh-context judges ran (full mode, or the no-plan source-touching path). `spike-rubric`: an explicit-spike fresh-context correctness judge ran the 3-check rubric. `hand-authored`: the implementing agent wrote the verdict with NO fresh-context judge. LOAD-BEARING CONTRACT: this value is set by the JUDGING step, never the implementer — and a consumer MUST treat an ABSENT or unrecognized provenance as `hand-authored` (the untrusting default; an un-stamped buffer reads as un-judged / self-reported, never machine-judged). `adversarial-judged` and `spike-rubric` are 'machine-judged' (a fresh-context judge produced the verdict); `hand-authored`/absent is 'self-reported'. HONEST LIMITATION: this is a cooperative-agent contract, not a cryptographic one — the renderers trust a `adversarial-judged`/`spike-rubric` value verbatim and do not (yet) cross-verify it against judge evidence, so a non-cooperative author could write the trusted value. The mechanically ENFORCED guarantee is the inverse asymmetry: an absent/unrecognized stamp can NEVER produce a machine `[x]` (omission is defended; commission is roadmapped — 'second-source the provenance stamp'). Additive in schema_version 1.0; older consumers ignore it."
          },
          "adversarial_cases": {
            "type": "array",
            "items": {"type": "string"},
            "description": "0-2 adversarial cases per adversarial.md output. Empty array when criterion is fully covered by its text."
          },
          "observations": {
            "type": "array",
            "description": "Discrete observation captures from bundled /verify, classified by type. Empty array when criterion was not exercised.",
            "items": {
              "type": "object",
              "required": ["type", "content"],
              "properties": {
                "type": {
                  "type": "string",
                  "enum": ["screenshot", "a11y_snapshot", "network", "console", "log", "stdout", "exit_code", "narrative"],
                  "description": "Observation discriminator. 'narrative' captures freeform /verify prose; the others are structured captures the HTML renderer can lay out distinctly."
                },
                "content": {
                  "type": "string",
                  "description": "The captured content. For 'screenshot' this is a relative path or base64 data URI; for 'a11y_snapshot' it's the snapshot text; for 'network' it's the request/response summary; for 'console'/'log'/'stdout' it's the log line; for 'narrative' it's the prose excerpt."
                },
                "timestamp_offset_ms": {
                  "type": "integer",
                  "description": "Optional milliseconds since verify start; helps HTML renderer order observations along a timeline.",
                  "minimum": 0
                }
              },
              "additionalProperties": false
            }
          },
          "verdicts": {
            "type": "object",
            "required": ["correctness", "regression", "scope-creep"],
            "properties": {
              "correctness": {"$ref": "#/definitions/dimension_verdict"},
              "regression": {"$ref": "#/definitions/dimension_verdict"},
              "scope-creep": {"$ref": "#/definitions/dimension_verdict"}
            },
            "additionalProperties": false
          },
          "aggregated_verdict": {
            "type": "string",
            "enum": ["PASS", "FAIL", "Unknown"],
            "description": "Per-criterion aggregation. PASS only if all three dimensions PASS. Any FAIL or Unknown propagates."
          },
          "grounding": {
            "type": "object",
            "description": "Optional. Why this surface looks/behaves as it does — the rationale column the HTML report renders (operationalizes FB-0040 'rationale carried' + FB-0037 designer-lens). Absent when no rationale was captured. Additive in schema_version 1.0; existing consumers ignore it.",
            "required": ["type", "statement"],
            "properties": {
              "type": {
                "type": "string",
                "enum": ["need", "design-language", "craft-commitment", "open-question"],
                "description": "Exactly one rationale type. 'need' = traced to a user job (cite it in citations); 'design-language' = follows a named system rule; 'craft-commitment' = a stated design stance; 'open-question' = no cohesive rationale yet (bridges to top-level open_questions). The anti-pattern is manufacturing a 'need' to launder a styling call."
              },
              "statement": {"type": "string", "description": "One-line rationale."},
              "citations": {
                "type": "array",
                "items": {"type": "string"},
                "description": "Citations resolved from config (specPath / designLanguagePath) or the plan's Spec-walk — never hardcoded project doc names."
              },
              "decision_test": {"type": "string", "description": "Optional — a named decision test run in-annotation, with its result."}
            },
            "additionalProperties": false
          }
        },
        "additionalProperties": false
      }
    },
    "not_tested": {
      "type": "array",
      "description": "Closed-form per-platform checklist from lib/not-tested-checklist.md. Agent flips tested=true only where it actually exercised the surface.",
      "items": {
        "type": "object",
        "required": ["item", "tested"],
        "properties": {
          "item": {"type": "string", "description": "Verbatim checklist item (e.g. 'Real device', 'Real network')."},
          "tested": {"type": "boolean", "description": "True only when the agent actually exercised this surface."},
          "rationale": {"type": "string", "description": "Optional one-sentence rationale, primarily for the false case."}
        },
        "additionalProperties": false
      }
    },
    "open_questions": {
      "type": "array",
      "description": "Optional. Subjective, human-facing questions surfaced for the merge gate — DISTINCT from an epistemic 'Unknown' verdict. 'Unknown' = 'I couldn't exercise this path'; an open_question = 'this is a taste/priority call only you should make'. Rendered as the report's standalone 'Open questions for you' block. A routing='this-iteration' entry blocks Step 8 auto-advance (mirrors an unresolved MEDIUM assumption); 'future-planning' routes to the roadmap. Additive in schema_version 1.0.",
      "items": {
        "type": "object",
        "required": ["question", "routing"],
        "properties": {
          "question": {"type": "string", "description": "Specific, answerable, with options."},
          "rationale": {"type": "string", "description": "Our view + why (strongly recommended; the report renders it)."},
          "recommended_default": {"type": "string", "description": "What keeps the loop moving if the human only half-glances (strongly recommended)."},
          "user_need_lens": {"type": "string", "description": "Which job/persona the question is about."},
          "routing": {
            "type": "string",
            "enum": ["this-iteration", "future-planning"],
            "description": "'this-iteration' blocks Step 8 auto-advance until the human answers (a 'this is wrong' re-enters Execute); 'future-planning' routes to the roadmap, non-blocking."
          }
        },
        "additionalProperties": false
      }
    },
    "frame_integrity": {
      "type": "array",
      "description": "Optional. One entry per captured `screenshot` observation, produced by /flow:verify-build Step 6's frame-integrity pass (lib/frame-integrity-checklist.md) — a FIXED, must-pass checklist run against every frame REGARDLESS of the plan's Visual-walk assertions (FB-0066). Catches the obvious-defect class no declared criterion names (broken safe-area background, seam, clipped text). DISTINCT from the per-criterion `verdicts` object: frame-integrity is a property of the FRAME (one frame can serve several criteria), so it lives top-level, not inside criteria[]. A single FAIL here forces overall_verdict FAIL (Step 7) independent of the per-dimension verdicts. Absent when no frames were captured. Additive in schema_version 1.0; older consumers ignore it.",
      "items": {
        "type": "object",
        "required": ["frame", "edges", "corners", "background_continuity", "verdict"],
        "properties": {
          "state": {"type": "string", "description": "The state / criterion this frame served, verbatim if given."},
          "frame": {"type": "string", "description": "The frame's relative path (e.g. 'assets/home.png') matching the screenshot observation's content."},
          "edges": {
            "type": "object",
            "required": ["top", "bottom", "left", "right"],
            "description": "Literal per-edge safe-area descriptions — the described evidence emitted BEFORE the verdict (anti-glance discipline). All four required and non-empty.",
            "properties": {
              "top": {"type": "string", "description": "What fills the top safe-area edge (notch / status bar)."},
              "bottom": {"type": "string", "description": "What fills the bottom safe-area edge (home indicator)."},
              "left": {"type": "string", "description": "What fills the left edge."},
              "right": {"type": "string", "description": "What fills the right edge."}
            },
            "additionalProperties": false
          },
          "corners": {"type": "string", "description": "Literal description of the four corners (rounding consistency, clipped content)."},
          "background_continuity": {"type": "string", "description": "Literal top-to-bottom description of background continuity (one continuous surface vs a seam / band)."},
          "verdict": {
            "type": "string",
            "enum": ["PASS", "FAIL"],
            "description": "PASS or FAIL ONLY — never Unknown for a readable frame. Frame-integrity items are single-frame absolute properties (a white notch band needs no baseline), so any failing item ⇒ FAIL; absence of a baseline is not an Unknown escape. An unreadable frame is a capture failure (not_tested[]), not a frame-integrity Unknown."
          },
          "failing_items": {
            "type": "array",
            "items": {"type": "string"},
            "description": "Verbatim checklist item text for each failure. Non-empty iff verdict is FAIL; empty array for PASS."
          },
          "notes": {"type": "string", "description": "One sentence naming the defect for FAIL; empty string for PASS."}
        },
        "additionalProperties": false
      }
    }
  },
  "definitions": {
    "dimension_verdict": {
      "type": "object",
      "required": ["verdict", "evidence", "notes"],
      "properties": {
        "verdict": {
          "type": "string",
          "enum": ["PASS", "FAIL", "Unknown"]
        },
        "evidence": {
          "type": "array",
          "minItems": 2,
          "maxItems": 2,
          "items": {"type": "string"},
          "description": "Exactly two verbatim quotes per the two-citation rule. First quote is from /verify observations; second is from the criterion / adversarial case / plan rule."
        },
        "notes": {
          "type": "string",
          "description": "One-sentence rationale for FAIL or Unknown. Empty string for PASS."
        }
      },
      "additionalProperties": false
    }
  },
  "additionalProperties": false
}
