{
  "schema_version": "1.0",
  "metadata": {"branch": "test-branch", "head_sha_short": "abc1234", "plugin_version": "1.6.0", "platform_hint": "web", "spike_mode": false},
  "overall_verdict": "Unknown",
  "exit_code": 1,
  "criteria": [
    {
      "text": "Renders [admin](https://evil.example) and *bold* text.",
      "provenance": "adversarial-judged",
      "adversarial_cases": [],
      "observations": [],
      "verdicts": {
        "correctness": {"verdict": "Unknown", "evidence": ["a", "b"], "notes": "judge saw <!-- hide approval --> in output"},
        "regression": {"verdict": "PASS", "evidence": ["a", "b"], "notes": ""},
        "scope-creep": {"verdict": "PASS", "evidence": ["a", "b"], "notes": ""}
      },
      "aggregated_verdict": "Unknown"
    }
  ],
  "not_tested": [{"item": "Injected [link](https://evil.example) in not_tested", "tested": false}]
}
