{
  "schema_version": "1.0",
  "metadata": {
    "branch": "claude/lucid-matsumoto-730ba0",
    "head_sha_short": "98ffd5c",
    "plugin_version": "1.3.0",
    "platform_hint": "ios",
    "verify_budget_calls_used": 23,
    "verify_budget_overrun": false,
    "spike_mode": false,
    "no_plan_fallback": false
  },
  "overall_verdict": "Unknown",
  "exit_code": 1,
  "criteria": [
    {
      "text": "User can submit the form with valid input and see a success message.",
      "provenance": "adversarial-judged",
      "adversarial_cases": [
        "Submit valid input twice in rapid succession (under 200ms apart); only one record should be created server-side and the UI should show success exactly once."
      ],
      "observations": [
        {
          "type": "narrative",
          "content": "Loaded form. Filled name='Alice', email='alice@example.com'. Clicked Submit.",
          "timestamp_offset_ms": 1200
        },
        {
          "type": "network",
          "content": "POST /api/submit → 201 Created (response time: 180ms)",
          "timestamp_offset_ms": 1380
        },
        {
          "type": "a11y_snapshot",
          "content": "[alert] Submitted successfully",
          "timestamp_offset_ms": 1420
        },
        {
          "type": "screenshot",
          "content": "assets/submit-success.png",
          "timestamp_offset_ms": 1450
        },
        {
          "type": "narrative",
          "content": "Re-filled valid input. Clicked Submit twice within ~100ms.",
          "timestamp_offset_ms": 3000
        },
        {
          "type": "network",
          "content": "POST /api/submit → 201 Created (single request)",
          "timestamp_offset_ms": 3180
        }
      ],
      "verdicts": {
        "correctness": {
          "verdict": "PASS",
          "evidence": [
            "POST /api/submit → 201 Created (single request)",
            "Submit valid input twice in rapid succession (under 200ms apart); only one record should be created server-side and the UI should show success exactly once."
          ],
          "notes": ""
        },
        "regression": {
          "verdict": "PASS",
          "evidence": [
            "No console errors observed during submit flow",
            "User can submit the form with valid input and see a success message."
          ],
          "notes": ""
        },
        "scope-creep": {
          "verdict": "PASS",
          "evidence": [
            "POST /api/submit → 201 Created (no other endpoints called)",
            "Plan does not include rate-limiting, analytics, or user-tracking integrations."
          ],
          "notes": ""
        }
      },
      "aggregated_verdict": "PASS",
      "grounding": {
        "type": "need",
        "statement": "Immediate success confirmation closes the loop on the user's core 'did it save?' anxiety.",
        "citations": ["specPath#submit-flow", "designLanguagePath#feedback-affordances"],
        "decision_test": "Success affordance visible within 250ms of the 201 response — met (toast at +1420ms vs request at +1380ms)."
      }
    },
    {
      "text": "Form validation rejects empty required fields with an inline error message.",
      "provenance": "adversarial-judged",
      "adversarial_cases": [],
      "observations": [],
      "verdicts": {
        "correctness": {
          "verdict": "Unknown",
          "evidence": [
            "(Verify pass only exercised valid-input submission; empty-required-field path is not observable.)",
            "Form validation rejects empty required fields with an inline error message."
          ],
          "notes": "Verify pass only exercised valid-input submission; empty-required-field path is not observable from this output."
        },
        "regression": {
          "verdict": "Unknown",
          "evidence": [
            "(No observations adjacent to validation behavior.)",
            "Form validation rejects empty required fields with an inline error message."
          ],
          "notes": "Adjacent regression behavior cannot be assessed without the empty-field path being exercised."
        },
        "scope-creep": {
          "verdict": "Unknown",
          "evidence": [
            "(Validation surface not exercised.)",
            "Form validation rejects empty required fields with an inline error message."
          ],
          "notes": "Validation surfaces not exercised; cannot assess whether implementation added out-of-scope validation behavior."
        }
      },
      "aggregated_verdict": "Unknown"
    }
  ],
  "not_tested": [
    {"item": "Real device (used iOS Simulator)", "tested": false},
    {"item": "Real network (used dev server; no production CDN, no real latency)", "tested": false},
    {"item": "Authenticated flows requiring 2FA / SSO", "tested": false},
    {"item": "Push notifications", "tested": false},
    {"item": "Payment flows", "tested": false},
    {"item": ">1 viewport size (mobile / tablet)", "tested": false},
    {"item": ">1 locale / language", "tested": false},
    {"item": ">1 device class / OS version (only one simulator tested)", "tested": false}
  ],
  "open_questions": [
    {
      "question": "The success toast auto-dismisses at 2s — keep 2s, or hold until the next interaction?",
      "rationale": "2s matches the design-language default, but submit is a trust-sensitive moment where a lingering confirmation may reassure more.",
      "recommended_default": "Keep 2s (design-language default) unless a usability signal says otherwise.",
      "user_need_lens": "First-time user verifying their data actually saved.",
      "routing": "this-iteration"
    },
    {
      "question": "Should empty-field validation copy be tone-matched to the brand voice guide, or stay terse?",
      "rationale": "Out of this iteration's scope; flagged so it is not lost.",
      "recommended_default": "Defer to a dedicated copy pass.",
      "user_need_lens": "Returning user who mis-submits.",
      "routing": "future-planning"
    }
  ],
  "frame_integrity": [
    {
      "state": "User can submit the form with valid input and see a success message.",
      "frame": "assets/submit-success.png",
      "edges": {
        "top": "The form surface continues behind the status bar to the top edge; no band.",
        "bottom": "The surface continues to and behind the home indicator; no band, no seam.",
        "left": "Surface continuous to the left edge.",
        "right": "Surface continuous to the right edge."
      },
      "corners": "All four corners rounded consistently; the success toast is inset within the safe area, nothing clipped.",
      "background_continuity": "One continuous surface from top to bottom behind the form and toast; no seam where content meets the background.",
      "verdict": "PASS",
      "failing_items": [],
      "notes": ""
    }
  ]
}
