{
  "schema_version": "1.0",
  "metadata": {
    "branch": "test-branch",
    "head_sha_short": "abc1234",
    "plugin_version": "1.9.1",
    "platform_hint": "ios",
    "verify_budget_calls_used": 0,
    "verify_budget_overrun": false,
    "spike_mode": false,
    "no_plan_fallback": true
  },
  "overall_verdict": "PASS",
  "exit_code": 0,
  "criteria": [
    {
      "text": "Home page renders the reworked hero layout.",
      "provenance": "hand-authored",
      "adversarial_cases": [],
      "observations": [
        {"type": "narrative", "content": "Implementer states the hero renders correctly."}
      ],
      "verdicts": {
        "correctness": {"verdict": "PASS", "evidence": ["Implementer states the hero renders correctly.", "Home page renders the reworked hero layout."], "notes": ""},
        "regression": {"verdict": "PASS", "evidence": ["No regressions noticed by implementer.", "Home page renders the reworked hero layout."], "notes": ""},
        "scope-creep": {"verdict": "PASS", "evidence": ["Only the hero changed.", "Plan scope is the hero rework."], "notes": ""}
      },
      "aggregated_verdict": "PASS"
    },
    {
      "text": "Tapping a card navigates to the detail screen.",
      "adversarial_cases": [],
      "observations": [],
      "verdicts": {
        "correctness": {"verdict": "PASS", "evidence": ["Implementer hand-checked navigation.", "Tapping a card navigates to the detail screen."], "notes": ""},
        "regression": {"verdict": "PASS", "evidence": ["No nav regressions noticed.", "Tapping a card navigates to the detail screen."], "notes": ""},
        "scope-creep": {"verdict": "PASS", "evidence": ["No extra screens added.", "Plan scope is card navigation."], "notes": ""}
      },
      "aggregated_verdict": "PASS"
    }
  ],
  "not_tested": [
    {"item": "Real device (hand-authored — nothing actually exercised)", "tested": false}
  ]
}
